{
  "$schema": "https://json-schema.org/draft/2020-12/schema",
  "$id": "https://github.com/samartomar/aih-extensions/source-declarations/v1.schema.json",
  "title": "aih-extensions source declaration, schema version 1",
  "description": "Public source data for the aih-extensions framework identity, pinned upstream provenance, owner-intended content groups and source-scoped compatibility facts. Source intent only: not an install plan, not a support claim, not an observed binding.",
  "type": "object",
  "required": ["schemaVersion", "identity", "provenance", "groups", "compatibility"],
  "additionalProperties": false,
  "properties": {
    "schemaVersion": {
      "description": "Versions this source format independently of the product release. Only 1 is defined.",
      "const": 1
    },
    "identity": {
      "type": "object",
      "required": ["name", "title", "description", "author", "license", "repository", "versionSource"],
      "additionalProperties": false,
      "properties": {
        "name": { "type": "string", "minLength": 1 },
        "title": { "type": "string", "minLength": 1 },
        "description": { "type": "string", "minLength": 1 },
        "author": {
          "type": "object",
          "required": ["name", "url"],
          "additionalProperties": false,
          "properties": {
            "name": { "type": "string", "minLength": 1 },
            "url": { "type": "string", "format": "uri" }
          }
        },
        "license": { "type": "string", "minLength": 1 },
        "repository": { "type": "string", "format": "uri" },
        "versionSource": {
          "description": "Where the canonical release version is authored; the declaration references it instead of copying a version number.",
          "type": "string",
          "pattern": "^[^#]+#[^#]+$"
        }
      }
    },
    "provenance": {
      "type": "object",
      "required": ["source", "upstreams"],
      "additionalProperties": false,
      "properties": {
        "source": { "description": "The authored file these pins are taken from.", "type": "string", "minLength": 1 },
        "upstreams": {
          "type": "array",
          "minItems": 1,
          "items": {
            "type": "object",
            "required": ["key", "repo", "sha", "vendored"],
            "additionalProperties": false,
            "properties": {
              "key": { "type": "string", "minLength": 1 },
              "repo": { "type": "string", "pattern": "^https://" },
              "sha": { "type": "string", "pattern": "^[a-f0-9]{40}$" },
              "vendored": { "description": "true when upstream content is copied into this repository by the vendor script; false when the upstream is installed from its own repository at this commit and never vendored here.", "type": "boolean" },
              "note": { "type": "string" }
            }
          }
        }
      }
    },
    "groups": {
      "description": "The content owner's intended groups. Every member must resolve to existing authored content in the distributed source. The same member may appear in several distinct groups; a duplicate inside one group is invalid. Groups the owner did not intend are omitted, never invented.",
      "type": "array",
      "minItems": 1,
      "items": {
        "type": "object",
        "required": ["id", "source", "members"],
        "additionalProperties": false,
        "properties": {
          "id": { "type": "string", "minLength": 1 },
          "source": { "description": "The authored metadata this grouping is taken from.", "type": "string", "minLength": 1 },
          "members": {
            "type": "array",
            "minItems": 1,
            "items": { "type": "string", "minLength": 1 },
            "uniqueItems": true
          }
        }
      }
    },
    "compatibility": {
      "type": "object",
      "required": ["facts"],
      "additionalProperties": false,
      "properties": {
        "facts": {
          "description": "Source-scoped compatibility facts and limitations. A fact never prescribes a per-tool install location, never marks a tool as supported and never claims an observed Core binding. Facts of kind 'verified' must carry evidence; absent evidence stays absent (null) and a fact without evidence must not be presented as verified.",
          "type": "array",
          "items": {
            "type": "object",
            "required": ["id", "tool", "kind", "statement", "source", "evidence"],
            "additionalProperties": false,
            "properties": {
              "id": { "type": "string", "minLength": 1 },
              "tool": {
                "description": "A stable public Core tool identifier, or 'all'. Used only to reference a known tool, never to claim an unobserved binding.",
                "enum": ["all", "claude", "codex", "cursor", "kimi", "opencode"]
              },
              "kind": { "enum": ["verified", "limitation", "requirement"] },
              "statement": { "type": "string", "minLength": 1 },
              "source": { "description": "The authored repository file this fact is recorded in.", "type": "string", "minLength": 1 },
              "evidence": {
                "type": ["object", "null"],
                "required": ["date", "platform"],
                "additionalProperties": false,
                "properties": {
                  "date": { "type": "string", "pattern": "^\\d{4}-\\d{2}-\\d{2}$" },
                  "platform": { "type": "string", "minLength": 1 },
                  "toolVersion": { "type": "string", "minLength": 1 },
                  "model": { "type": "string", "minLength": 1 }
                }
              }
            }
          }
        }
      }
    }
  }
}
